Timeline,en_dialogue,bengali_dialogue
"00:03:02,057 --> 00:03:04,016",She looks at me every day.,তিনি প্রতিদিন আমার দিকে তাকান।
"00:03:04,184 --> 00:03:05,977",Mary jane Watson.,মেরি জেন ​​ওয়াটসন।
"00:03:06,144 --> 00:03:10,189","Oh, boy. lf she only knew how l felt about her.","ওহ, ছেলে। সে শুধু জানত আমি কিভাবে তার সম্পর্কে অনুভূত।"
"00:03:10,357 --> 00:03:12,149",But she can never know.,কিন্তু সে কখনো জানতে পারে না।
"00:03:12,317 --> 00:03:15,778",I made a choice once to live a life of responsibility.,আমি বাস একবার একটি পছন্দ করেছেন দায়িত্ব একটি জীবন।
"00:03:15,946 --> 00:03:18,239",A life she can never be a part of.,একটি জীবন তিনি একটি অংশ হতে পারে না।
"00:03:18,407 --> 00:03:19,699",Who am I?,আমি কে?
"00:03:19,867 --> 00:03:22,451","I'm Spider-Man, given a job to do.","আমি স্পাইডার-ম্যান, একটি কাজ দেওয়া।"
"00:03:22,619 --> 00:03:25,621","And l'm Peter Parker, and I, too, have a job.","এবং আমি পিটার পার্কার, এবং আমি, খুব, একটি কাজ আছে।"
"00:03:25,789 --> 00:03:27,373",Parker. Parker!,পার্কার। পার্কার!
"00:03:27,833 --> 00:03:29,792","No, no, no, stop! Stop!","না, না, না, থামো! বন্ধ করুন!"
"00:03:31,211 --> 00:03:33,880","Parker, you're late, man. Always late.","পার্কার, তুমি দেরী, মানুষ। সবসময় দেরী."
"00:03:34,047 --> 00:03:36,966","I'm sorry, Mr. Aziz. There was a disturbance.","আমি দুঃখিত, মি। আজিজ। একটি ঝামেলা ছিল।"
"00:03:37,134 --> 00:03:39,427",Another disturbance. Always a disturbance with you.,অন্য ঝামেলা। সর্বদা আপনার সাথে একটি ঝামেলা।
"00:03:39,595 --> 00:03:42,388","Come on, 21 minutes ago, in comes order.","আসুন, 21 মিনিট আগে, আদেশ আসে।"
"00:03:42,556 --> 00:03:46,142","Harmattan, Burton and Smith. Eight extra-large deep-dish pizzas.","হারমান্টন, বার্টন এবং স্মিথ। আট অতিরিক্ত বড় গভীর থালা pizzas।"
"00:03:46,310 --> 00:03:49,186","In eight minutes, I am defaulting on Joe's 29-minute guarantee.","আট মিনিটের মধ্যে, আমি ডিফল্ট করছি জো এর 29 মিনিটের গ্যারান্টি।"
"00:03:49,354 --> 00:03:52,315","Then, not only am I receiving no money for these pizzas...","তারপর, আমি গ্রহণ করছি না এই pizzas জন্য কোন টাকা ..."
"00:03:52,482 --> 00:03:55,151",...but l will lose the customer forever to Pizza Yurt.,... কিন্তু আমি চিরদিন গ্রাহক হারাবো পিজা ইয়ার্ট যাও।
"00:03:55,319 --> 00:03:58,696","Look, you are my only hope, all right? You have to make it in time.","দেখো, তুমি আমার একমাত্র আশা, ঠিক আছে? আপনি সময় এটি করতে হবে।"
"00:03:58,864 --> 00:04:02,617","Peter, you're a nice guy. But you're just not dependable.","পিটার, তুমি একটা চমৎকার লোক। কিন্তু আপনি শুধু নির্ভরযোগ্য না।"
"00:04:02,993 --> 00:04:04,827",This is your last chance.,এই আপনার শেষ সুযোগ।
"00:04:04,995 --> 00:04:09,749",You have to go 42 blocks in 7 1/2 minutes or your ass is fired.,আপনি 42 ব্লক যেতে হবে 7 1/2 মিনিটে বা আপনার গাধা বহিস্কার করা হয়।
"00:04:11,460 --> 00:04:13,336",Go!,যান!
"00:04:35,609 --> 00:04:37,193","Hey, what, are you stupid?","আরে, তুমি কি বোকা?"
"00:04:59,132 --> 00:05:02,301",Whoa! He stole that guy's pizzas!,ওহো! সে সেই লোকের পিজ্জা চুরি করল!
"00:05:11,019 --> 00:05:12,603",I'm gonna get it!,আমি এটা পেতে যাচ্ছি!
"00:05:28,245 --> 00:05:30,579","Hey, you guys. No playing in the streets.",আরে আপনাকে বলছি. কোন রাস্তায় বাজানো।
"00:05:30,747 --> 00:05:31,998","Yes, Mr. Spider-Man.","হ্যাঁ, মি। স্পাইডার-ম্যান।"
"00:05:32,290 --> 00:05:33,958",See you.,দেখা হবে.
"00:05:35,127 --> 00:05:36,419","Way to go, Spidey!","যেতে হবে, স্পাইডি!"
"00:06:29,306 --> 00:06:31,182",Pizza time.,পিজা সময়।
"00:06:35,937 --> 00:06:37,521",You're late.,আপনি দেরি করে ফেলেছেন.
"00:06:38,482 --> 00:06:39,815",I'm not paying for those.,আমি তাদের জন্য পরিশোধ করছি না।
"00:06:57,959 --> 00:06:59,835","Joe's 29-minute guarantee is a promise, man.","জো এর 29 মিনিটের গ্যারান্টি একটি প্রতিশ্রুতি, মানুষ।"
"00:07:03,673 --> 00:07:08,177","I know to you, Parker, a promise means nothing. But to me, it's serious.","আমি জানি, পার্কার, একটা প্রতিশ্রুতি কিছুই মানে। কিন্তু আমার কাছে এটা গুরুতর।"
"00:07:08,845 --> 00:07:10,805","It's serious to me too, Mr. Aziz.","এটাও আমার জন্য গুরুতর, মিঃ আজিজ।"
"00:07:10,972 --> 00:07:13,474","-You're fired. Go. -Please, l need this job.","-আপনি বহিষ্কৃত. যান। - দয়া করে, আমি এই কাজ প্রয়োজন।"
"00:07:13,642 --> 00:07:16,185","-You're fired. -Look, give me another chance.","-আপনি বহিষ্কৃত. দেখো, আমাকে আরেকটা সুযোগ দাও।"
"00:07:23,276 --> 00:07:24,610",You're fired.,আপনি বহিষ্কৃত.
"00:07:24,945 --> 00:07:26,946","-Parker, hello. You're fired. -Why?","- পার্কার, হ্যালো। আপনি বহিষ্কৃত. -Why?"
"00:07:27,113 --> 00:07:28,614",Dogs catching Frisbees?,Frisbees ধরা কুকুর?
"00:07:28,782 --> 00:07:31,116",Pigeons in the park? A couple geezers playing chess?,পার্কের কবুতর? একটি দম্পতি geezers দাবা খেলা?
"00:07:31,284 --> 00:07:32,493",-Boss. -Not now.,-Boss। -এখন না.
"00:07:32,661 --> 00:07:35,412",The Bugle could show another side of New York for a change.,Bugle অন্য দিকে প্রদর্শন করতে পারে পরিবর্তন জন্য নিউ ইয়র্ক এর।
"00:07:35,580 --> 00:07:38,499","We got six minutes to deadline, Jonah. We need page one.",ইউনাইটেডের ছয় মিনিট আমরা শেষ করেছি! আমরা এক পৃষ্ঠা প্রয়োজন।
"00:07:38,667 --> 00:07:42,086",I don't pay you to be a sensitive artiste. I pay you-- Still not now!,আমি আপনাকে একটি সংবেদনশীল শিল্পী হতে দিতে না। আমি তোমাকে টাকা দিচ্ছি - এখনও না!
"00:07:42,254 --> 00:07:44,839",I pay you because that psycho Spider-Man will pose for you.,আমি আপনাকে কারণ যে psycho দিতে স্পাইডার-ম্যান আপনার জন্য জাহির করা হবে।
"00:07:45,006 --> 00:07:46,757",He won't let me take any more pictures.,সে আমাকে নিতে দেবে না আরো ছবি।
"00:07:46,925 --> 00:07:48,509",You turned the whole city against him.,আপনি পুরো শহর পরিণত তার বিরুদ্ধে.
"00:07:48,677 --> 00:07:50,177",A fact l'm very proud of.,একটি সত্য আমি খুব গর্বিত।
"00:07:50,345 --> 00:07:54,139",Get your pretty little portfolio off my desk before I go into a diabetic coma.,আমার বন্ধ একটু সুন্দর পোর্টফোলিও পান আমি ডায়াবেটিক কোমা মধ্যে যেতে আগে ডেস্ক।
"00:07:54,307 --> 00:07:57,643","-lt's your wife, she lost her checkbook. -Thanks for the good news.","- তোমার স্ত্রী, সে তার চেকবই হারিয়ে গেছে। - ভাল খবর জন্য ধন্যবাদ।"
"00:07:57,811 --> 00:08:01,146","Please, isn't there any of these shots you can use? I need the money.","দয়া করে, এই শট কোন আছে না তুমি ব্যবহার করতে পার? আমার টাকাটা দরকার."
"00:08:02,524 --> 00:08:04,358",Miss Brant. Get me a violin.,মিস ব্রান্ট। আমাকে একটি লঙ্ঘন পান।
"00:08:04,526 --> 00:08:06,235","Five minutes to deadline, Jonah.","পাঁচ মিনিট সময়সীমা, ইউনূস।"
"00:08:06,403 --> 00:08:09,113",Run a picture of a rancid chicken. Here's the headline:,একটি rancid মুরগীর একটি ছবি চালান। এখানে শিরোনাম:
"00:08:09,281 --> 00:08:11,156","""Food Poisoning Scare Sweeps City.""","""খাদ্য বিষাক্ত ভয়ঙ্কর Sweeps সিটি।"""
"00:08:11,324 --> 00:08:13,659",-Some food got poisoned? -l'm a little nauseous.,কিছু খাবার বিষাক্ত হয়ে গেছে? আমি একটু বিরক্তিকর।
"00:08:13,827 --> 00:08:15,661","All right, Mr. Jameson.","ঠিক আছে, মিঃ জেমসন।"
"00:08:17,372 --> 00:08:19,540","It stinks. Robbie, there's your page one.","এটা অপ্রীতিকর. রবি, আপনার পেজ এক।"
"00:08:19,708 --> 00:08:21,333","""Masked Menace Terrorizes Town.""","""মাস্কেড মেনেস টাউন সন্ত্রাস।"""
"00:08:21,501 --> 00:08:23,085","I told you, he's not a menace.","আমি তোমাকে বলেছিলাম, সে কোন বিপদ নয়।"
"00:08:23,253 --> 00:08:24,837",-l told you-- -l'll take care of it.,- তোমাকে বললাম-- - এটা যত্ন নিতে হবে।
"00:08:25,005 --> 00:08:26,672",-l'll give you 150. -Three hundred.,তোমাকে 150 দেবে। -তিনশত.
"00:08:27,048 --> 00:08:28,340",That's outrageous.,এটা অসম্মানজনক।
"00:08:28,508 --> 00:08:30,467",Done. Give this to the girl.,সম্পন্ন. এই মেয়ে দিতে।
"00:08:30,635 --> 00:08:31,844",Thank you. Bye-bye.,ধন্যবাদ. বাই-বাই।
"00:08:32,304 --> 00:08:33,804",Hi.,হাই।
"00:08:34,014 --> 00:08:35,472","Hey, Pete.","আরে, পিট।"
"00:08:38,435 --> 00:08:42,271",I don't think this covers the advance I gave you a couple weeks ago.,আমি এই আগাম আচ্ছাদিত মনে করি না আমি আপনাকে কয়েক সপ্তাহ আগে দিয়েছেন।
"00:08:42,606 --> 00:08:44,565",-Right. -Sorry.,-Right। -Sorry।
"00:08:45,775 --> 00:08:47,026",Hey.,আরে।
"00:08:47,527 --> 00:08:49,069","Chin up, okay?","চিন আপ, ঠিক আছে?"
"00:09:02,208 --> 00:09:03,667","Watch it, jerk!","দেখো, জারক!"
"00:09:14,387 --> 00:09:16,305",Dr. Connors. Sorry.,ড। দুঃখিত।
"00:09:16,473 --> 00:09:18,015","Where were you headed, Parker?",কোথায় গেলেন পার্কার?
"00:09:18,224 --> 00:09:19,475",To your class.,আপনার ক্লাসে।
"00:09:19,643 --> 00:09:21,477",My class is over.,আমার ক্লাস শেষ হয়।
"00:09:21,645 --> 00:09:23,854",See me standing here?,আমাকে এখানে দাঁড়িয়ে দেখুন?
"00:09:24,022 --> 00:09:27,816",I'm sorry. I'm trying. I wanna be here.,আমি দুঃখিত. আমি চেষ্টা করছি. আমি এখানে থাকতে চাই।
"00:09:27,984 --> 00:09:29,318",Then be here.,তারপর এখানে থাকুন।
"00:09:30,695 --> 00:09:32,154","Look at you, Peter.","তোমাকে দেখ, পিটার।"
"00:09:32,697 --> 00:09:37,034",Your grades have been steadily declining. You're late for class.,আপনার গ্রেড অবিরাম হয়েছে পড়ন্ত। আপনি ক্লাসের জন্য দেরি হয়ে গেছে।
"00:09:37,202 --> 00:09:40,079",You always appear exhausted.,আপনি সবসময় ক্লান্ত প্রদর্শিত।
"00:09:41,539 --> 00:09:43,582",Your paper on fusion is still overdue.,ফিউশন আপনার কাগজ এখনও বিলম্বিত।
"00:09:43,750 --> 00:09:46,919",I know. I'm planning to write it on Dr. Otto Octavius.,আমি জানি. আমি এটা লিখতে পরিকল্পনা করছি অটো অক্টাভিয়াস ডা।
"00:09:47,087 --> 00:09:50,255",Planning is not a major at this university.,পরিকল্পনা একটি প্রধান নয় এই বিশ্ববিদ্যালয়ে।
"00:09:53,593 --> 00:09:55,594",Octavius is a friend of mine.,অক্টাভিয়াস আমার বন্ধু।
"00:09:55,929 --> 00:09:57,930","Better do your research, Parker.","ভাল আপনার গবেষণা, পার্কার।"
"00:09:58,264 --> 00:10:01,433","Get it done, or I'm failing you.","এটা সম্পন্ন করুন, অথবা আমি আপনাকে ব্যর্থ করছি।"
"00:10:22,789 --> 00:10:24,957",Surprise!,বিস্ময়!
"00:10:25,125 --> 00:10:27,042","Well, say something.","আচ্ছা, কিছু বলো"
"00:10:27,210 --> 00:10:28,460",What's the occasion?,উপলক্ষটা কি?
"00:10:28,628 --> 00:10:31,213","Really, Peter. It's your birthday!","সত্যিই, পিটার। এটা তোমার জন্মদিন!"
"00:10:31,756 --> 00:10:34,550",Whether you want to remember it or not.,তুমি যা চাও এটা মনে রাখা বা না।
"00:10:34,926 --> 00:10:38,220","He lives in another reality. Don't you, Pete?","তিনি অন্য বাস্তবতা বাস। না, পিট?"
"00:10:38,388 --> 00:10:40,305","-Hi, M.j. -Hi.","- হাই, এম। জে। -Hi।"
"00:10:40,807 --> 00:10:42,182","-Hey, buddy. -Hey.",-ওহে বন্ধু. -Hey।
"00:10:42,350 --> 00:10:43,600","Long time, no see.",অনেক দিন ধরে দেখা নেই.
"00:10:44,477 --> 00:10:47,646",So how's the play? I read a great review.,সুতরাং খেলা কিভাবে? আমি একটি মহান পর্যালোচনা পড়া।
"00:10:47,814 --> 00:10:49,481",It's going fine. lt's going good.,এটা ঠিক যাচ্ছে। ভালো লেগেছে।
"00:10:49,649 --> 00:10:50,941",She's brilliant in it.,তিনি এটা উজ্জ্বল।
"00:10:51,109 --> 00:10:52,776",Harry sent me roses.,হ্যারি আমাকে গোলাপ পাঠিয়েছে।
"00:10:52,944 --> 00:10:55,487","So where you been, pal? You don't return my calls.",তাহলে তুমি কোথায় ছিলে? আপনি আমার কল ফিরে না।
"00:10:56,990 --> 00:10:58,824",I've been busy.,আমি ব্যস্ত ছিলাম.
"00:10:58,992 --> 00:11:02,578",Taking pictures of Spider-Man? How's the bug these days?,স্পাইডার-ম্যান ছবি তোলা? কিভাবে এই দিন বাগ?
"00:11:02,746 --> 00:11:04,705","The less you see of that man, the better.","আপনি যে মানুষ কম দেখতে, ভাল।"
"00:11:04,873 --> 00:11:08,333","Now, let's all go into the other room and have something to eat.","এখন, সব অন্য কক্ষ মধ্যে যান এবং কিছু খেতে আছে।"
"00:11:08,501 --> 00:11:09,793",I'll get the hors d'oeuvres.,আমি ঘোড়া d'oeuvres পাবেন।
"00:11:09,961 --> 00:11:12,087",So how are things going at Oscorp?,সুতরাং ওসকর্পে কীভাবে চলছে?
"00:11:12,255 --> 00:11:15,132",They're great. I'm head of Special Projects.,তারা মহৎ. আমি বিশেষ প্রকল্প প্রধান।
"00:11:15,300 --> 00:11:17,509",We're about to make a breakthrough on fusion.,আমরা তৈরি করতে চলেছি ফিউশন একটি breakthrough।
"00:11:17,677 --> 00:11:21,805","How lovely, Harry. Your father would be so proud, rest his soul.","কত সুন্দর, হ্যারি। আপনার বাবা তাই গর্বিত হবে, তার আত্মা বিশ্রাম।"
"00:11:21,973 --> 00:11:23,265",Thank you.,ধন্যবাদ.
"00:11:23,683 --> 00:11:27,436","We're actually funding one of your idols, Pete. Otto Octavius.","আমরা আসলে অর্থায়ন করছি আপনার মূর্তি এক, পিট। Otto Octavius।"
"00:11:27,604 --> 00:11:30,022",-l'm writing a paper on him. -You want to meet him?,আমি তাকে একটি কাগজ লিখছি। তুমি কি তাকে দেখা করতে চাও?
"00:11:30,190 --> 00:11:31,482",You'd introduce me?,আপনি আমাকে পরিচয় করিয়ে দিবেন?
"00:11:31,649 --> 00:11:34,860",You bet. Octavius is gonna put Oscorp on the map...,আপনি বাজি। Octavius ​​হয় ওসকর্পকে মানচিত্রে রাখবে ...
"00:11:35,028 --> 00:11:37,029",...in a way my father never even dreamed of.,... একটি উপায় আমার বাবা এমনকি স্বপ্নেও না।
"00:11:37,197 --> 00:11:39,156","M.j., could you give me a hand?","এম। জে।, তুমি কি আমাকে হাত দিতে পার?"
"00:11:41,534 --> 00:11:43,118","She's waiting for you, pal.","সে তোমার জন্য অপেক্ষা করছে, বাবা।"
"00:11:43,828 --> 00:11:45,037",What do you mean?,আপনি কি বোঝাতে চেয়েছেন?
"00:11:45,205 --> 00:11:47,706",The way she looks at you or doesn't look at you.,তিনি আপনাকে দেখায় উপায় অথবা আপনি তাকান না।
"00:11:48,249 --> 00:11:49,625",However you want to look at it.,তবে আপনি এটি তাকান করতে চান।
"00:11:49,959 --> 00:11:52,127",I don't have time for girls right now.,আমি এখন মেয়েদের জন্য সময় নেই।
"00:11:52,295 --> 00:11:53,629","Why, are you dead?",কেন তুমি মারা গেছো?
"00:11:53,797 --> 00:11:55,297",I've been kind of busy.,আমি ব্যস্ত ধরনের হয়েছে।
"00:11:55,548 --> 00:11:57,174",Taking pictures of your friend?,আপনার বন্ধু ছবি গ্রহণ?
"00:11:58,635 --> 00:12:00,177",Could we get off that subject?,আমরা যে বিষয় বন্ধ পেতে পারি?
"00:12:00,678 --> 00:12:03,680","I want us to be friends, Harry. I want us to trust each other.","আমি আমাদের বন্ধু হতে চাই, হ্যারি। আমি আমাদের একে অপরের বিশ্বাস করতে চান।"
"00:12:03,848 --> 00:12:05,474",Then be honest with me.,তারপর আমার সাথে সৎ হতে।
"00:12:05,975 --> 00:12:08,352","If you knew who he was, would you tell me?","যদি আপনি জানতেন তিনি কে ছিলেন, তুমি কি আমাকে বলবে?"
"00:12:31,960 --> 00:12:33,460",May.,থাকুক।
"00:12:33,628 --> 00:12:35,170","Oh, what, Ben?","ওহ, কি, বেন?"
"00:12:36,506 --> 00:12:38,465",Wait.,অপেক্ষা করুন।
"00:12:38,675 --> 00:12:40,092","-Aunt May. -Oh, my.",আন্ট মে। -আহারে.
"00:12:40,510 --> 00:12:45,722","Oh, Peter. Oh, for a second there, I thought I was years ago.","ওহ, পিটার। ওহ, এক সেকেন্ডের জন্য, আমি ভেবেছিলাম আমি অনেক বছর আগে।"
"00:12:47,934 --> 00:12:49,852","Everybody's gone, aren't they?","সবাই চলে গেছে, তাই না?"
"00:12:50,311 --> 00:12:51,979",Did they have a good time?,তারা কি একটি ভাল সময় আছে?
"00:12:52,480 --> 00:12:53,730",I'm sure they did.,আমি নিশ্চিত তারা কি।
"00:12:55,567 --> 00:12:59,403",-You okay? -Of course. But you go home.,-তুমি ঠিক আছ? -অবশ্যই. কিন্তু আপনি বাড়িতে যান।
"00:13:00,029 --> 00:13:05,200",And be careful. l don't like that scooter thing you drive around.,এবং সতর্কতা অবলম্বন করা। আমি এটা পছন্দ করি না আপনি প্রায় ড্রাইভ স্কুটার জিনিস।
"00:13:05,952 --> 00:13:07,161",I'm worried about you.,আমি আপনার সম্পর্কে চিন্তিত.
"00:13:07,579 --> 00:13:12,541",You're so alone. And l saw the letter from the bank.,তুমি খুব একা এবং আমি ব্যাংক থেকে চিঠি দেখেছি।
"00:13:12,709 --> 00:13:15,169","Oh, my. You did?",আহারে. তুমি করেছ?
"00:13:15,670 --> 00:13:17,004","Oh, well.",আচ্ছা ভালো.
"00:13:17,172 --> 00:13:18,589",So?,তাই?
"00:13:19,174 --> 00:13:20,841",I'm a little behind.,আমি একটু পিছনে আছি।
"00:13:21,843 --> 00:13:23,552",Everybody is.,সকলেই.
"00:13:24,220 --> 00:13:27,222","Anyway, I don't want to talk about it anymore.","যাইহোক, আমি চাই না আর এটা সম্পর্কে কথা বলতে।"
"00:13:27,390 --> 00:13:31,101","I'm tired, and you better start back home.","আমি ক্লান্ত, এবং আপনি ভাল বাড়িতে ফিরে শুরু।"
"00:13:32,896 --> 00:13:35,397","Here, kiddo. Happy birthday.","এখানে, kiddo। শুভ জন্মদিন."
"00:13:35,773 --> 00:13:37,399",You need it more than I do.,আপনি এটা আমার চেয়ে আরো প্রয়োজন।
"00:13:37,567 --> 00:13:40,068","-No, I can't take that from you. -Yes, you can!","- না, আমি আপনার কাছ থেকে এটা নিতে পারছি না। -হ্যা, তুমি পারো!"
"00:13:40,236 --> 00:13:42,279",You can take this money from me.,আপনি আমার কাছ থেকে এই টাকা নিতে পারেন।
"00:13:42,447 --> 00:13:45,199","For God's sake, it's not much. Now, take it!","ঈশ্বরের জন্য, এটা অনেক না। এখন, এটা গ্রহণ!"
"00:13:45,366 --> 00:13:47,868",And don't you dare leave it here.,এবং আপনি এটা এখানে ছেড়ে সাহস না।
"00:13:48,036 --> 00:13:49,953","Oh, l'm sorry.","ওহ, আমি দুঃখিত।"
"00:13:51,164 --> 00:13:54,708",It's just that l miss your uncle Ben so much.,এটা শুধু যে আমি মিস আপনার মামা বেন অনেক।
"00:13:56,836 --> 00:14:01,757",Can you believe that it's two years next month since he was taken?,আপনি এটা দুই বছর বিশ্বাস করতে পারেন পরের মাসে তাকে নিয়ে যাওয়া হলো?
"00:14:04,093 --> 00:14:06,303",I think to myself at times...,আমি মাঝে মাঝে নিজেকে মনে করি ...
"00:14:07,472 --> 00:14:11,767","...were I to face the one responsible for what happened, l'd....","... আমি দায়ী এক মুখোমুখি ছিল কি ঘটেছিল, আমি ...."
"00:14:12,810 --> 00:14:14,853","Oh, l don't know what l'd do.","ওহ, আমি জানি না কি করবো।"
"00:14:21,402 --> 00:14:22,986",Now...,এখন ...
"00:14:24,906 --> 00:14:27,616",...you better take the rest of your cake home.,... আপনি ভাল নিতে আপনার পিষ্টক হোম বাকি।
