Timeline,en_dialogue,bengali_dialogue
"00:14:44,008 --> 00:14:46,176",Hey. You're still here.,আরে। আপনি এখনও এখানে আছেন।
"00:14:47,261 --> 00:14:48,929",I saw your billboard on Bleecker.,আমি ব্লিকার আপনার বিলবোর্ড দেখেছি।
"00:14:49,138 --> 00:14:52,391",Isn't it funny? I'm really kind of embarrassed.,এটা মজার না? আমি সত্যিই বিব্রত বোধ করছি।
"00:14:52,558 --> 00:14:56,645",Don't be. lt's nice. I get to see you every day now.,হতে হবে না। লেট এর চমৎকার। আমি এখন আপনি প্রতিদিন দেখতে পাবেন।
"00:14:59,357 --> 00:15:01,692","I liked seeing you tonight, Peter.","আমি তোমাকে আজ রাতে দেখেছিলাম, পিটার।"
"00:15:03,945 --> 00:15:05,696","Oh, boy, yeah.","ওহ, ছেলে, হ্যাঁ।"
"00:15:06,322 --> 00:15:09,282","""Oh, boy, yeah"" what?","""ওহ, ছেলে, হাঁ"" কি?"
"00:15:13,788 --> 00:15:15,455",Nothing.,কিছুই নেই।
"00:15:19,711 --> 00:15:21,670",Do you want to say something?,আপনি কি কিছু বলতে চান?
"00:15:27,677 --> 00:15:29,261",I...,আমি ...
"00:15:35,184 --> 00:15:36,476",...was...,... ছিল ...
"00:15:37,478 --> 00:15:40,731",...wondering if you're still in the Village.,... আপনি এখনও যদি ভাবছি গ্রামে.
"00:15:49,866 --> 00:15:51,908",You're such a mystery.,আপনি যেমন একটি রহস্য।
"00:16:02,170 --> 00:16:03,962",Peter.,পিটার।
"00:16:05,381 --> 00:16:06,882",What?,কি?
"00:16:11,888 --> 00:16:13,597",Happy birthday.,শুভ জন্মদিন.
"00:16:22,273 --> 00:16:24,441",I'm seeing somebody now.,আমি এখন কাউকে দেখছি।
"00:16:25,068 --> 00:16:27,444","You mean, like a boyfriend?",আপনি একটি প্রেমিক মত মানে?
"00:16:27,612 --> 00:16:30,280","Well, like I like him.","আচ্ছা, আমি তাকে পছন্দ করি।"
"00:16:38,081 --> 00:16:41,333","That's good, you know? Companionship....","এটা ভাল, তুমি জানো? সাহচর্য্য ...."
"00:16:43,044 --> 00:16:44,711",May be more than that.,যে বেশী হতে পারে।
"00:16:45,797 --> 00:16:47,380",More?,আরো?
"00:16:48,091 --> 00:16:49,549",I don't know.,আমি জানি না।
"00:16:50,885 --> 00:16:53,095",I'm coming to see your play tomorrow night.,আমি আপনার খেলা দেখতে আসছি আগামীকাল রাত.
"00:16:56,140 --> 00:16:59,101",-You're coming? -l'll be there.,-তুমি আসছ? আমি সেখানে থাকব।
"00:17:00,103 --> 00:17:01,770",Don't disappoint me.,আমাকে হতাশ করবেন না।
"00:17:03,231 --> 00:17:04,898",I won't.,আমি করবো না
"00:17:19,080 --> 00:17:20,622",Rent.,ভাড়া।
"00:17:24,460 --> 00:17:27,129","-Hi. -Hi. What's ""hi""?","-Hi। -Hi। ""হাই"" কি?"
"00:17:27,296 --> 00:17:28,797",Can l spend it?,আমি কি এটা ব্যয় করতে পারি?
"00:17:29,549 --> 00:17:31,466",I have a paycheck due this week and--,আমি এই সপ্তাহে একটি paycheck আছে এবং--
"00:17:31,634 --> 00:17:34,970",-You're a month late again. Again. -l promise as soon as--,- আপনি আবার দেরী একটি মাস। আবার। শীঘ্রই হিসাবে প্রতিশ্রুতি -
"00:17:35,263 --> 00:17:38,640","If promises were crackers, my daughter would be fat.","প্রতিশ্রুতি ক্র্যাকার্স ছিল, আমার মেয়ে চর্বি হবে।"
"00:17:39,225 --> 00:17:43,728","I'm really sorry, Mr. Ditkovitch. All I got is this 20 for the rest of the week.","আমি সত্যিই দুঃখিত, মি। ডিটকভিচ। সব আমি এই সপ্তাহ বাকি জন্য 20 পেয়েছিলাম।"
"00:17:44,397 --> 00:17:45,939","""Sorry"" doesn't pay the rent.","""দুঃখিত"" ভাড়া পরিশোধ না।"
"00:17:46,107 --> 00:17:50,986",And don't try to sneak past me. I have ears like a cat and eyes like a rodent.,এবং আমার অতীতের ছিঁচকে চোর চেষ্টা করবেন না। আমার আছে একটি বিড়াল মত একটি বিড়াল এবং চোখ মত কান।
"00:17:52,655 --> 00:17:55,532","-Thanks, Mr. Ditkovitch. -Hi, Pete.","ধন্যবাদ, মি। ডিটকভিচ। - হাই, পিট।"
"00:18:42,371 --> 00:18:43,955",Hello?,হ্যালো?
"00:18:51,339 --> 00:18:53,048",Rent?,ভাড়া?
"00:18:58,137 --> 00:19:00,513",Doctor? Mr. Osborn's here.,ডক্টর? মিঃ ওসবার্ন এখানে।
"00:19:00,681 --> 00:19:04,559","Nobel Prize, Otto. Nobel Prize. And we'll all be rich.","নোবেল পুরস্কার, ওটো। নোবেল পুরস্কার. এবং আমরা সবাই সমৃদ্ধ হবে।"
"00:19:04,894 --> 00:19:06,519","It's not about the prizes, Harry.","এটা পুরস্কারের কথা না, হ্যারি।"
"00:19:06,687 --> 00:19:08,480",But you need money. You need Oscorp.,কিন্তু আপনি টাকা প্রয়োজন। আপনি Oscorp প্রয়োজন।
"00:19:08,648 --> 00:19:09,940",Who do we have here?,আমরা এখানে আছে কে?
"00:19:10,107 --> 00:19:11,858",This is my good friend I called you about.,এই আমার ভাল বন্ধু আমি তোমাকে ডেকেছি।
"00:19:12,026 --> 00:19:13,693",He got me through high-school science.,তিনি আমাকে মাধ্যমে পেয়েছিলাম উচ্চ বিদ্যালয় বিজ্ঞান।
"00:19:13,861 --> 00:19:16,863","Peter Parker, sir. I'm writing a paper on you for--","পিটার পার্কার, স্যার। আমি আপনার জন্য একটি কাগজ লিখছি -"
"00:19:17,031 --> 00:19:18,448",I know what you're doing here...,আমি জানি তুমি এখানে কি করছ
"00:19:18,616 --> 00:19:20,909",...but l don't have time to talk to students now.,... কিন্তু আমার সময় নেই এখন ছাত্রদের সাথে কথা বলতে।
"00:19:21,869 --> 00:19:23,703","But Oscorp pays the bills, so....","কিন্তু ওসকর্প বিল পরিশোধ করে, তাই ...."
"00:19:23,871 --> 00:19:26,206",That's why I have to take off. Board meeting.,এজন্যই আমাকে নিতে হবে। বোর্ড মিটিং.
"00:19:26,374 --> 00:19:29,751",But my job is done here. Got you two geniuses together.,কিন্তু আমার কাজ এখানে সম্পন্ন করা হয়। আপনি একসাথে দুটি geniuses পেয়েছিলাম।
"00:19:29,919 --> 00:19:34,506","Good luck tomorrow, Otto. Nobel Prize. We'll see you in Sweden!","গুড লাক আগামীকাল, Otto। নোবেল পুরস্কার. আমরা আপনাকে সুইডেন দেখতে হবে!"
"00:19:37,218 --> 00:19:38,718","Interesting fellow, your friend.","আকর্ষণীয় সহকর্মী, আপনার বন্ধু।"
"00:19:39,345 --> 00:19:41,012",I won't take much of your time.,আমি আপনার সময় অনেক নিতে হবে না।
"00:19:41,180 --> 00:19:45,558",Now I remember you. You're Connors' student. He tells me you're brilliant.,এখন আমি আপনাকে মনে। আপনি Connors ' ছাত্র. তিনি আমাকে বলছেন আপনি উজ্জ্বল।
"00:19:46,352 --> 00:19:48,436",He also tells me you're lazy.,তিনি আমাকে আপনি অলস বলে।
"00:19:49,438 --> 00:19:50,689",I'm trying to do better.,আমি ভাল কাজ করার চেষ্টা করছি।
"00:19:50,856 --> 00:19:54,442","Being brilliant's not enough, young man. You have to work hard.","উজ্জ্বল হচ্ছে যথেষ্ট নয়, যুবক. আপনি কঠোর পরিশ্রম করতে হবে।"
"00:19:54,777 --> 00:19:57,946","Intelligence is not a privilege, it's a gift.","গোয়েন্দা একটি বিশেষাধিকার নয়, এটা একটা উপহার."
"00:19:58,114 --> 00:20:00,282",And you use it for the good of mankind.,এবং আপনি এটি ব্যবহার মানবজাতির ভাল জন্য।
"00:20:00,449 --> 00:20:01,908",You want to try it back there?,আপনি এটা আবার চেষ্টা করতে চান?
"00:20:02,743 --> 00:20:04,286",So is that it?,তাই এটা কি?
"00:20:04,453 --> 00:20:08,873",Yes. My design to initiate and sustain fusion.,হ্যাঁ। আমার নকশা শুরু এবং সংযম বজায় রাখা।
"00:20:09,292 --> 00:20:12,168",I understand you use harmonics of atomic frequencies.,আমি আপনি harmonics ব্যবহার বুঝতে পারমাণবিক ফ্রিকোয়েন্সি।
"00:20:12,336 --> 00:20:13,712",Sympathetic frequencies.,সহানুভূতিশীল ফ্রিকোয়েন্সি।
"00:20:13,879 --> 00:20:15,922",Harmonic reinforcement?,হারমনিক শক্তিবৃদ্ধি?
"00:20:16,257 --> 00:20:17,966",Go on.,যান।
"00:20:18,551 --> 00:20:22,095",An exponential increase in energy output.,একটি সূচকীয় বৃদ্ধি শক্তি আউটপুট।
"00:20:22,263 --> 00:20:23,930",A huge amount of energy.,শক্তি বিপুল পরিমাণ।
"00:20:24,098 --> 00:20:28,268",Like a perpetual sun providing renewable power for the whole world.,একটি চিরস্থায়ী সূর্য প্রদান মত সমগ্র বিশ্বের জন্য পুনর্নবীকরণযোগ্য শক্তি।
"00:20:28,436 --> 00:20:31,646",Are you sure you could stabilise the fusion reaction?,আপনি কি স্থির করতে পারছেন? ফিউশন প্রতিক্রিয়া?
"00:20:31,814 --> 00:20:35,150","Peter, what have we been talking about for the last hour and a half?","পিটার, আমরা কি কথা বলছি গত দেড় ঘন্টা ধরে?"
"00:20:35,818 --> 00:20:37,652",This is my life's work.,এটা আমার জীবনের কাজ।
"00:20:37,945 --> 00:20:41,156",I certainly know the consequences of the slightest miscalculation.,আমি অবশ্যই ফলাফল জানি সামান্যতম ভুল ধারণা।
"00:20:41,324 --> 00:20:43,616",I'm sorry. I didn't mean to question you.,আমি দুঃখিত. আমি আপনাকে প্রশ্ন করার অর্থ ছিল না।
"00:20:43,784 --> 00:20:47,162","Rosie, our new friend thinks I'm gonna blow up the city.","Rosie, আমাদের নতুন বন্ধু মনে করে আমি শহরকে উড়িয়ে দিচ্ছি।"
"00:20:47,330 --> 00:20:49,164",You can sleep soundly tonight.,আপনি আজ রাতে ধীরে ধীরে ঘুমাতে পারেন।
"00:20:49,332 --> 00:20:51,041",Otto's done his homework.,Otto তার হোমওয়ার্ক সম্পন্ন।
"00:20:51,208 --> 00:20:54,336","Come to the demonstration tomorrow, and you'll see for yourself.","আগামীকাল বিক্ষোভে আসুন, এবং আপনি নিজের জন্য দেখতে পাবেন।"
"00:20:54,795 --> 00:20:57,005","And you need to sleep soundly tonight, Otto.","এবং আপনি প্রয়োজন আজ রাতে জোরে ঘুমাতে, অটো।"
"00:20:57,173 --> 00:20:59,341",Did Edison sleep before he turned on the light?,এডিসন ঘুমানো কি? তিনি আলো চালু আগে?
"00:20:59,800 --> 00:21:02,135",Did Marconi sleep before he turned on the radio?,মার্কোনি ঘুমানো রেডিও চালু করার আগে?
"00:21:02,303 --> 00:21:04,429",Did Beethoven sleep before he wrote the 5th?,বিথোভেন ঘুমানো 5 র্থ লেখা আগে?
"00:21:04,597 --> 00:21:07,891",Did Bernoulli sleep before he found the curves of quickest descent?,তিনি খুঁজে পাওয়া আগে বার্নউলি ঘুমিয়ে ছিল দ্রুততম বংশবৃদ্ধি এর বাঁক?
"00:21:08,059 --> 00:21:10,560","Rosie, l love this boy.","Rosie, আমি এই ছেলে ভালবাসা।"
"00:21:10,728 --> 00:21:14,522","Peter, tell us about yourself. Do you have a girlfriend?","পিটার, আমাদের সম্পর্কে আমাদের বলুন। আপনি একটি বান্ধবী আছে না?"
"00:21:15,566 --> 00:21:17,150",Well....,ওয়েল ....
"00:21:18,235 --> 00:21:19,652",I don't really know.,আমি সত্যিই জানি না।
"00:21:19,820 --> 00:21:22,906","Well, shouldn't you know? I mean, who would know?","আচ্ছা, আপনি কি জানেন না? মানে, কে জানবে?"
"00:21:23,157 --> 00:21:26,117",Leave him alone. Maybe it's a secret love.,তাকে একা থাকতে দাও. হয়তো এটি একটি গোপন প্রেম।
"00:21:26,285 --> 00:21:28,203",Love should never be a secret.,প্রেম একটি গোপন করা উচিত নয়।
"00:21:28,371 --> 00:21:31,623",If you keep something as complicated as love stored up inside...,আপনি জটিল হিসাবে কিছু রাখুন ভালবাসা ভিতরে সংরক্ষণ হিসাবে ...
"00:21:32,375 --> 00:21:34,000",...gonna make you sick.,... তোমাকে অসুস্থ করতে হবে।
"00:21:34,585 --> 00:21:36,419",I finally got lucky in love.,আমি অবশেষে প্রেম ভাগ্যবান পেয়েছিলাম।
"00:21:36,587 --> 00:21:37,921",We both did.,আমরা উভয় করেনি।
"00:21:38,089 --> 00:21:41,800",But it's hardly perfect. You have to work at it.,কিন্তু এটা খুব নিখুঁত। আপনি এটা কাজ করতে হবে।
"00:21:41,967 --> 00:21:45,678","I met him on the college steps, and l knew it wasn't going to be easy.","আমি কলেজের ধাপে তার সাথে দেখা করেছিলাম, এবং আমি জানতাম এটা সহজ হতে যাচ্ছে না।"
"00:21:45,846 --> 00:21:49,099","He was studying science, and l was studying English literature.","তিনি বিজ্ঞান অধ্যয়নরত ছিল, এবং আমি ইংরেজি সাহিত্য অধ্যয়নরত ছিল।"
"00:21:49,266 --> 00:21:52,435",That's right. l was trying to explain the theory of relativity.,সেটা ঠিক. আমি ব্যাখ্যা করার চেষ্টা করছিলাম আপেক্ষিকতার তত্ত্ব।
"00:21:52,603 --> 00:21:55,105",And Rosie was trying to explain T.S. Eliot.,আর রোজি চেষ্টা করছিল টিএস ব্যাখ্যা করতে ইলিয়ট।
"00:21:56,399 --> 00:21:58,358",I still don't understand what he was talking about.,আমি এখনও বুঝতে পারছি না সে কি সম্পর্কে কথা বলছিল।
"00:21:58,526 --> 00:21:59,734","-Yes, you do. -l'm serious.",-হ্যাঁ তুমি কর. আমি গুরুতর।
"00:21:59,902 --> 00:22:03,446",T.S. Eliot is more complicated than advanced science.,T.S. এলিয়ট আরো জটিল উন্নত বিজ্ঞান চেয়ে।
"00:22:04,031 --> 00:22:07,951","But if you want to get a woman to fall in love with you, feed her poetry.","কিন্তু যদি আপনি একটি মহিলার পড়া পেতে চান আপনার সাথে প্রেম, তার কবিতা খাওয়া।"
"00:22:08,411 --> 00:22:09,619",Poetry.,কবিতা।
"00:22:11,080 --> 00:22:12,288",Never fails.,ব্যর্থ হইও না.
"00:22:16,919 --> 00:22:19,838",A tall and slender maiden All alone upon a prairie,একটি লম্বা এবং পাতলা মেয়ের সমস্ত একটি prairie উপর একা
"00:22:20,005 --> 00:22:22,382",Brightest green were all her garments,উজ্জ্বল সবুজ তার সব পোশাক ছিল
"00:22:22,550 --> 00:22:24,926",And her hair was like the sunshine,এবং তার চুল রোদ মত ছিল
"00:22:25,302 --> 00:22:27,971",Day by day he gazed upon her,প্রতিদিন সে তার উপর নজর রাখলো
"00:23:25,196 --> 00:23:26,863",Rent!,ভাড়া আদায়!
"00:23:28,741 --> 00:23:30,450",Where is my money?!,আমার টাকা কোথায় ?!
"00:23:56,101 --> 00:23:58,394",You seem jittery tonight.,আপনি আজ রাতে জাগ্রত মনে।
"00:23:58,562 --> 00:24:00,230",You never know who's coming.,আপনি কে আসছে জানি না।
"00:24:15,704 --> 00:24:18,665","Ladies, five minutes. Five minutes.","মহিলা, পাঁচ মিনিট। পাঁচ মিনিট."
"00:24:35,849 --> 00:24:37,183",How'd you do that?,কিভাবে আপনি যে কিভাবে?
"00:24:40,187 --> 00:24:42,564","Work out, plenty of rest.","কাজ, বিশ্রাম প্রচুর।"
"00:24:42,731 --> 00:24:44,524","You know, eat your green vegetables.","আপনি জানেন, আপনার সবুজ সবজি খাওয়া।"
"00:24:45,442 --> 00:24:48,945",That's what my mom is always saying. I just never actually believed her.,যে আমার মায়ের সবসময় বলছে কি। আমি শুধু তার বিশ্বাস না।
"00:24:51,740 --> 00:24:53,116",Come on. Go.,চলে আসো. যান।
"00:24:56,036 --> 00:24:57,453",Keep it steady.,এটা অবিচলিত রাখুন।
"00:25:19,977 --> 00:25:21,477",It's a web.,এটি একটি ওয়েব।
"00:25:22,605 --> 00:25:24,314","Go, Spidey, go!","যাও, স্পাইডি, যাও!"
"00:25:32,323 --> 00:25:33,656",We got trouble!,আমরা কষ্ট পেয়েছি!
"00:25:52,259 --> 00:25:54,218",Get me down!,আমাকে নিচে পেতে!
"00:25:54,928 --> 00:25:57,764",I am more than content with what Mr. Moncrieff said.,আমি কন্টেন্ট চেয়ে বেশি মিঃ মনক্রিফের সাথে কি বলেন।
"00:25:57,931 --> 00:26:01,225",His voice alone inspires one with absolute credulity.,তাঁর ভয়েস একা অনুপ্রাণিত পরম বিশ্বাস সঙ্গে।
"00:26:01,393 --> 00:26:03,519",Then you think we should forgive them?,তাহলে আপনি আমাদের উচিত তাদেরকে ক্ষমা কর?
"00:26:06,398 --> 00:26:08,066",Yes.,হ্যাঁ।
"00:26:08,567 --> 00:26:10,068","I mean, no.","আমি বলতে চাচ্ছি, না।"
"00:26:14,365 --> 00:26:18,660","Hey. Hey. Hey, chief. You park there, I'm towing it.","আরে। আরে। আরে, প্রধান। আপনি সেখানে পার্ক, আমি এটা দমন করছি।"
"00:26:19,328 --> 00:26:20,662",Whatever.,যাই হোক.